<?xml version="1.0" encoding="UTF-8"?>
<!ELEMENT ModuleTables (ModuleTable+)>
<!ELEMENT ModuleTable (moduleName, tableName, described)>
<!ATTLIST ModuleTable ignore (true|false) "false">
<!ELEMENT moduleName (#PCDATA)>
<!ELEMENT tableName (#PCDATA)>
<!ELEMENT described (#PCDATA)>